language,link,question_number,question,n_correct,correct_models,wrong_models
est_Latn,https://en.wikivoyage.org/wiki/Hostels,2,Kes viibib selle lõigu põhjal kõige tõenäolisemalt hostelis?,4,anthropic_claude-haiku-4.5|anthropic_claude-sonnet-4.6|google_gemma-4-26b-a4b-it|local_Gemma-4_E4B_Q8_0_think,
est_Latn,https://en.wikivoyage.org/wiki/Indigenous_Australian_culture,1,Milline järgmistest väidetest kirjeldab selle lõigu järgi täpselt bumerangi viskamist?,4,anthropic_claude-haiku-4.5|anthropic_claude-sonnet-4.6|google_gemma-4-26b-a4b-it|local_Gemma-4_E4B_Q8_0_think,
est_Latn,https://en.wikivoyage.org/wiki/Indonesian_cuisine,1,Millist järgmistest toiduainetest kasutatakse peamiselt Jaava köögis?,4,anthropic_claude-haiku-4.5|anthropic_claude-sonnet-4.6|google_gemma-4-26b-a4b-it|local_Gemma-4_E4B_Q8_0_think,
est_Latn,https://en.wikivoyage.org/wiki/Infectious_diseases,1,Kuidas levib selle lõigu järgi nakkushaigus?,4,anthropic_claude-haiku-4.5|anthropic_claude-sonnet-4.6|google_gemma-4-26b-a4b-it|local_Gemma-4_E4B_Q8_0_think,
est_Latn,https://en.wikivoyage.org/wiki/Internet_access,1,"Millise stsenaariumi puhul oleks kasutaja jaoks piisav, kui ta valiks veebiproksi isikliku VPN-teenuse pakkuja asemel?",4,anthropic_claude-haiku-4.5|anthropic_claude-sonnet-4.6|google_gemma-4-26b-a4b-it|local_Gemma-4_E4B_Q8_0_think,
est_Latn,https://en.wikivoyage.org/wiki/Internet_telephony,1,Mis võimaldab kellelgi kasutada telefonifirmat väljaspool oma lähipiirkonda?,4,anthropic_claude-haiku-4.5|anthropic_claude-sonnet-4.6|google_gemma-4-26b-a4b-it|local_Gemma-4_E4B_Q8_0_think,
est_Latn,https://en.wikivoyage.org/wiki/Internet_telephony,2,"Mida võib selle lõigu järgi olla vaja teha, et saada teatud kõnesid?",4,anthropic_claude-haiku-4.5|anthropic_claude-sonnet-4.6|google_gemma-4-26b-a4b-it|local_Gemma-4_E4B_Q8_0_think,
est_Latn,https://en.wikivoyage.org/wiki/Italian_phrasebook,1,Milline järgmistest sõnadest ei kirjelda täpselt itaalia keele sõnade hääldust?,4,anthropic_claude-haiku-4.5|anthropic_claude-sonnet-4.6|google_gemma-4-26b-a4b-it|local_Gemma-4_E4B_Q8_0_think,
est_Latn,https://en.wikivoyage.org/wiki/Izmir,1,Milline järgmistest Izmiri tunnustest pärineb tänapäevale eelnevast ajast?,4,anthropic_claude-haiku-4.5|anthropic_claude-sonnet-4.6|google_gemma-4-26b-a4b-it|local_Gemma-4_E4B_Q8_0_think,
est_Latn,https://en.wikivoyage.org/wiki/Japan%27s_Top_100_Cherry_Blossom_Spots,1,Sõna hanami viitab mille vaatamisele?,4,anthropic_claude-haiku-4.5|anthropic_claude-sonnet-4.6|google_gemma-4-26b-a4b-it|local_Gemma-4_E4B_Q8_0_think,
est_Latn,https://en.wikivoyage.org/wiki/Japan%27s_Top_100_Cherry_Blossom_Spots,2,Kes korraldas esimesed kirsiõite vaatamisele pühendatud peod?,4,anthropic_claude-haiku-4.5|anthropic_claude-sonnet-4.6|google_gemma-4-26b-a4b-it|local_Gemma-4_E4B_Q8_0_think,
est_Latn,https://en.wikivoyage.org/wiki/Jerusalem,2,"Millist neist ei mainita tekstis kui midagi, mille poolest Jeruusalemm on tuntud?",4,anthropic_claude-haiku-4.5|anthropic_claude-sonnet-4.6|google_gemma-4-26b-a4b-it|local_Gemma-4_E4B_Q8_0_think,
est_Latn,https://en.wikivoyage.org/wiki/Maori_culture,2,"Millist neist ei ole mainitud kui tüüpilist viisi, kuidas kuumutada hangi auku?",4,anthropic_claude-haiku-4.5|anthropic_claude-sonnet-4.6|google_gemma-4-26b-a4b-it|local_Gemma-4_E4B_Q8_0_think,
est_Latn,https://en.wikivoyage.org/wiki/Meteora,1,Mis võib kaasa tuua munga või nunna erilise tunnustuse?,4,anthropic_claude-haiku-4.5|anthropic_claude-sonnet-4.6|google_gemma-4-26b-a4b-it|local_Gemma-4_E4B_Q8_0_think,
est_Latn,https://en.wikivoyage.org/wiki/Mobile_phones,1,Millal ei oleks satelliittelefon sobiv mobiiltelefoni asendaja?,4,anthropic_claude-haiku-4.5|anthropic_claude-sonnet-4.6|google_gemma-4-26b-a4b-it|local_Gemma-4_E4B_Q8_0_think,
est_Latn,https://en.wikivoyage.org/wiki/Mobile_phones,2,Millal oleks satelliittelefon parem kui mobiiltelefon?,4,anthropic_claude-haiku-4.5|anthropic_claude-sonnet-4.6|google_gemma-4-26b-a4b-it|local_Gemma-4_E4B_Q8_0_think,
est_Latn,https://en.wikivoyage.org/wiki/Moldova,1,Milline konflikt järgmistest põhjustas Transnistria Vabariigi loomise?,4,anthropic_claude-haiku-4.5|anthropic_claude-sonnet-4.6|google_gemma-4-26b-a4b-it|local_Gemma-4_E4B_Q8_0_think,
est_Latn,https://en.wikivoyage.org/wiki/Murals_and_graffiti,2,"Milline järgmistest teguritest oleks selle lõigu kohaselt seotud väljakujunenud grafitikunstnikuga, erinevalt vandaalitsemisest?",4,anthropic_claude-haiku-4.5|anthropic_claude-sonnet-4.6|google_gemma-4-26b-a4b-it|local_Gemma-4_E4B_Q8_0_think,
est_Latn,https://en.wikivoyage.org/wiki/Music_festival_circuit,1,Millist muusikafestivalide aspekti peavad mõned osalejad elamuse oluliseks osaks?,4,anthropic_claude-haiku-4.5|anthropic_claude-sonnet-4.6|google_gemma-4-26b-a4b-it|local_Gemma-4_E4B_Q8_0_think,
est_Latn,https://en.wikivoyage.org/wiki/Music_festival_circuit,2,"Mida peaks festivali külastaja selle lõigu kohaselt eelistama, kui ta soovib telkida muusika läheduses?",4,anthropic_claude-haiku-4.5|anthropic_claude-sonnet-4.6|google_gemma-4-26b-a4b-it|local_Gemma-4_E4B_Q8_0_think,
est_Latn,https://en.wikivoyage.org/wiki/New_Mexico_Pueblos,1,"Milliseid kohti peaksid külastajad selle lõigu kohaselt vältima, kui nad otsivad ööelu New Mexico põhjaosas?",4,anthropic_claude-haiku-4.5|anthropic_claude-sonnet-4.6|google_gemma-4-26b-a4b-it|local_Gemma-4_E4B_Q8_0_think,
est_Latn,https://en.wikivoyage.org/wiki/New_Mexico_Pueblos,2,"Selle lõigu kohaselt, kust leiab külastaja kõige tõenäolisemalt tuntud meelelahutust New Mexico põhjaosas?",4,anthropic_claude-haiku-4.5|anthropic_claude-sonnet-4.6|google_gemma-4-26b-a4b-it|local_Gemma-4_E4B_Q8_0_think,
est_Latn,https://en.wikivoyage.org/wiki/Noum%C3%A9a,1,Millist tüüpi jooki võiksid eelarveteadlikud reisijad vältida?,4,anthropic_claude-haiku-4.5|anthropic_claude-sonnet-4.6|google_gemma-4-26b-a4b-it|local_Gemma-4_E4B_Q8_0_think,
est_Latn,https://en.wikivoyage.org/wiki/Noum%C3%A9a,2,Millist järgmistest joogitellimustest võib teenindaja selles lõigus kirjeldatud piirkonna põhjal tõenäoliselt segi ajada?,4,anthropic_claude-haiku-4.5|anthropic_claude-sonnet-4.6|google_gemma-4-26b-a4b-it|local_Gemma-4_E4B_Q8_0_think,
est_Latn,https://en.wikivoyage.org/wiki/Paraguay,1,"Koloniseerimise perioodi, mis kestis kolm sajandit, alustas milline rühm?",4,anthropic_claude-haiku-4.5|anthropic_claude-sonnet-4.6|google_gemma-4-26b-a4b-it|local_Gemma-4_E4B_Q8_0_think,
est_Latn,https://en.wikivoyage.org/wiki/Paris,1,"Milline on selle lõigu järgi parim viis, kuidas panna pariislane endaga sõbrustama?",4,anthropic_claude-haiku-4.5|anthropic_claude-sonnet-4.6|google_gemma-4-26b-a4b-it|local_Gemma-4_E4B_Q8_0_think,
est_Latn,https://en.wikivoyage.org/wiki/Past_events/Wikimania_2018_Cape_Town_Guidebook,1,Mis on Kaplinna MetroRaili esimese klassi eelis?,4,anthropic_claude-haiku-4.5|anthropic_claude-sonnet-4.6|google_gemma-4-26b-a4b-it|local_Gemma-4_E4B_Q8_0_think,
est_Latn,https://en.wikivoyage.org/wiki/Past_events/Wikimania_2018_Cape_Town_Guidebook,2,Mis on selle lõigu kohaselt igal Kaplinna lähirongil?,4,anthropic_claude-haiku-4.5|anthropic_claude-sonnet-4.6|google_gemma-4-26b-a4b-it|local_Gemma-4_E4B_Q8_0_think,
est_Latn,https://en.wikivoyage.org/wiki/Pests,1,Millist järgmistest teguritest loomakahjur tõenäoliselt ei tee?,4,anthropic_claude-haiku-4.5|anthropic_claude-sonnet-4.6|google_gemma-4-26b-a4b-it|local_Gemma-4_E4B_Q8_0_think,
est_Latn,https://en.wikivoyage.org/wiki/Phone_service,1,Kust saab osta ettemakstud telefonikaarte?,4,anthropic_claude-haiku-4.5|anthropic_claude-sonnet-4.6|google_gemma-4-26b-a4b-it|local_Gemma-4_E4B_Q8_0_think,
est_Latn,https://en.wikivoyage.org/wiki/Plitvice_Lakes_National_Park,1,Milline järgmistest puudest on Plitvice järvede rahvuspargis vähem levinud?,4,anthropic_claude-haiku-4.5|anthropic_claude-sonnet-4.6|google_gemma-4-26b-a4b-it|local_Gemma-4_E4B_Q8_0_think,
est_Latn,https://en.wikivoyage.org/wiki/Plitvice_Lakes_National_Park,2,Millist järgmistest haruldastest loomadest võib leida Plitvice järvede rahvuspargis?,4,anthropic_claude-haiku-4.5|anthropic_claude-sonnet-4.6|google_gemma-4-26b-a4b-it|local_Gemma-4_E4B_Q8_0_think,
est_Latn,https://en.wikivoyage.org/wiki/Regional_coding,1,Mille puhul aitavad piirkonnakoodid selle lõigu kohaselt tegelikult kaasa?,4,anthropic_claude-haiku-4.5|anthropic_claude-sonnet-4.6|google_gemma-4-26b-a4b-it|local_Gemma-4_E4B_Q8_0_think,
est_Latn,https://en.wikivoyage.org/wiki/Returning_home,1,Milline protsess on teie kodumaale saabumisel tavaliselt mitteametlik?,4,anthropic_claude-haiku-4.5|anthropic_claude-sonnet-4.6|google_gemma-4-26b-a4b-it|local_Gemma-4_E4B_Q8_0_think,
est_Latn,https://en.wikivoyage.org/wiki/Rock_climbing,1,Mis võimaldab selle lõigu kohaselt ronijatel Cochamó orus pidevalt uusi marsruute avastada?,4,anthropic_claude-haiku-4.5|anthropic_claude-sonnet-4.6|google_gemma-4-26b-a4b-it|local_Gemma-4_E4B_Q8_0_think,
est_Latn,https://en.wikivoyage.org/wiki/Round_the_world_flights,1,"Kes katab lõunapoolkeral kõige rohkem ületusi, tuginedes selles lõigus esitatud teabele?",4,anthropic_claude-haiku-4.5|anthropic_claude-sonnet-4.6|google_gemma-4-26b-a4b-it|local_Gemma-4_E4B_Q8_0_think,
est_Latn,https://en.wikivoyage.org/wiki/Round_the_world_flights,2,Milline lennuühendus katab kõige vähem ookeaniülesõite lõunapoolkeral?,4,anthropic_claude-haiku-4.5|anthropic_claude-sonnet-4.6|google_gemma-4-26b-a4b-it|local_Gemma-4_E4B_Q8_0_think,
est_Latn,https://en.wikivoyage.org/wiki/Salar_de_Uyuni,1,Mis vähendaks selle lõigu kohaselt ekskursiooni maksumust?,4,anthropic_claude-haiku-4.5|anthropic_claude-sonnet-4.6|google_gemma-4-26b-a4b-it|local_Gemma-4_E4B_Q8_0_think,
est_Latn,https://en.wikivoyage.org/wiki/Salar_de_Uyuni,2,Kes võiks selle lõigu kohaselt kindlustada endale tõenäoliselt parima ringreisi maksumuse?,4,anthropic_claude-haiku-4.5|anthropic_claude-sonnet-4.6|google_gemma-4-26b-a4b-it|local_Gemma-4_E4B_Q8_0_think,
est_Latn,https://en.wikivoyage.org/wiki/San_Francisco,1,Mis aitas selle lõigu kohaselt kaasa San Francisco ülemaailmsele tuntusele?,4,anthropic_claude-haiku-4.5|anthropic_claude-sonnet-4.6|google_gemma-4-26b-a4b-it|local_Gemma-4_E4B_Q8_0_think,
est_Latn,https://en.wikivoyage.org/wiki/Sleep,1,Millisele reisijatüübile ei ole selle lõigu kohaselt reisibüroo teenustest tõenäoliselt kasu?,4,anthropic_claude-haiku-4.5|anthropic_claude-sonnet-4.6|google_gemma-4-26b-a4b-it|local_Gemma-4_E4B_Q8_0_think,
est_Latn,https://en.wikivoyage.org/wiki/Sleep,2,Millist neist ei mainita selles lõigus reisibüroo kaudu broneerimise eelisena?,4,anthropic_claude-haiku-4.5|anthropic_claude-sonnet-4.6|google_gemma-4-26b-a4b-it|local_Gemma-4_E4B_Q8_0_think,
est_Latn,https://en.wikivoyage.org/wiki/Smartphone_apps_for_travellers,1,Milleks ei ole reaalajas töötavad tekstitõlkija rakendused selle lõigu kohaselt võimelised?,4,anthropic_claude-haiku-4.5|anthropic_claude-sonnet-4.6|google_gemma-4-26b-a4b-it|local_Gemma-4_E4B_Q8_0_think,
est_Latn,https://en.wikivoyage.org/wiki/Snow_safety,1,Milline järgmistest teguritest ei ole laviini vallandaja?,4,anthropic_claude-haiku-4.5|anthropic_claude-sonnet-4.6|google_gemma-4-26b-a4b-it|local_Gemma-4_E4B_Q8_0_think,
est_Latn,https://en.wikivoyage.org/wiki/Snow_safety,2,Milline alljärgnevatest tuleb selle lõigu kohaselt alla laviinina?,4,anthropic_claude-haiku-4.5|anthropic_claude-sonnet-4.6|google_gemma-4-26b-a4b-it|local_Gemma-4_E4B_Q8_0_think,
est_Latn,https://en.wikivoyage.org/wiki/South_Asian_cuisine,1,Millised koostisained on selle lõigu kohaselt karri aluseks?,4,anthropic_claude-haiku-4.5|anthropic_claude-sonnet-4.6|google_gemma-4-26b-a4b-it|local_Gemma-4_E4B_Q8_0_think,
est_Latn,https://en.wikivoyage.org/wiki/South_Asian_cuisine,2,Millise koostisosa asemel kasutatakse mõnes piirkonnas karris mõnikord kookospiima?,4,anthropic_claude-haiku-4.5|anthropic_claude-sonnet-4.6|google_gemma-4-26b-a4b-it|local_Gemma-4_E4B_Q8_0_think,
est_Latn,https://en.wikivoyage.org/wiki/Southern_Africa,1,"Mida ei ole selles lõigus mainitud kui midagi, mida turistid peaksid Lõuna-Aafrikat uurides silmas pidama?",4,anthropic_claude-haiku-4.5|anthropic_claude-sonnet-4.6|google_gemma-4-26b-a4b-it|local_Gemma-4_E4B_Q8_0_think,
est_Latn,https://en.wikivoyage.org/wiki/Southern_Africa,2,"Mida peetakse selle lõigu kohaselt halvaks nõuandeks turistidele, kes soovivad uurida Lõuna-Aafrika Vabariiki autoga?",4,anthropic_claude-haiku-4.5|anthropic_claude-sonnet-4.6|google_gemma-4-26b-a4b-it|local_Gemma-4_E4B_Q8_0_think,
est_Latn,https://en.wikivoyage.org/wiki/Stay_safe,1,"Millist järgmistest asjaoludest ei ole selles lõigus mainitud kui võimalikku ohtu, mis kaasneb oma pagasi järelevalveta jätmisega?",4,anthropic_claude-haiku-4.5|anthropic_claude-sonnet-4.6|google_gemma-4-26b-a4b-it|local_Gemma-4_E4B_Q8_0_think,
est_Latn,https://en.wikivoyage.org/wiki/Stay_safe,2,Mida ei mainita selles lõigus seoses narkootikumide vedamisega?,4,anthropic_claude-haiku-4.5|anthropic_claude-sonnet-4.6|google_gemma-4-26b-a4b-it|local_Gemma-4_E4B_Q8_0_think,
est_Latn,https://en.wikivoyage.org/wiki/Staycation,2,"Millist järgmistest kohtadest peaksite külastama puhkuse ajal, kui teie linn on tuntud oma joogikultuuri poolest?",4,anthropic_claude-haiku-4.5|anthropic_claude-sonnet-4.6|google_gemma-4-26b-a4b-it|local_Gemma-4_E4B_Q8_0_think,
est_Latn,https://en.wikivoyage.org/wiki/Streymoy,1,Kus asuvad tuviskulptuurid?,4,anthropic_claude-haiku-4.5|anthropic_claude-sonnet-4.6|google_gemma-4-26b-a4b-it|local_Gemma-4_E4B_Q8_0_think,
est_Latn,https://en.wikivoyage.org/wiki/Studying_abroad,1,"Millist tüüpi viisa puhul võidakse nõuda, et keegi tõendaks piisavat rahalist toetust?",4,anthropic_claude-haiku-4.5|anthropic_claude-sonnet-4.6|google_gemma-4-26b-a4b-it|local_Gemma-4_E4B_Q8_0_think,
est_Latn,https://en.wikivoyage.org/wiki/Studying_abroad,2,Kes vajavad kõige tõenäolisemalt pikendatud viisat?,4,anthropic_claude-haiku-4.5|anthropic_claude-sonnet-4.6|google_gemma-4-26b-a4b-it|local_Gemma-4_E4B_Q8_0_think,
est_Latn,https://en.wikivoyage.org/wiki/Sundarbans_National_Park,2,Milline osa metsast asub India territooriumil?,4,anthropic_claude-haiku-4.5|anthropic_claude-sonnet-4.6|google_gemma-4-26b-a4b-it|local_Gemma-4_E4B_Q8_0_think,
est_Latn,https://en.wikivoyage.org/wiki/Thimphu,2,"Mis oleks hea nõuanne turistile, kes soovib sõita linnaosadevahelisest bussijaamast itta?",4,anthropic_claude-haiku-4.5|anthropic_claude-sonnet-4.6|google_gemma-4-26b-a4b-it|local_Gemma-4_E4B_Q8_0_think,
est_Latn,https://en.wikivoyage.org/wiki/Timbuktu,1,Milline järgnevatest ei ole Timbuktu täpne kirjeldus?,4,anthropic_claude-haiku-4.5|anthropic_claude-sonnet-4.6|google_gemma-4-26b-a4b-it|local_Gemma-4_E4B_Q8_0_think,
est_Latn,https://en.wikivoyage.org/wiki/Tornado_safety,1,Millisel hetkel muutub lehter selle lõigu järgi tornaadoks?,4,anthropic_claude-haiku-4.5|anthropic_claude-sonnet-4.6|google_gemma-4-26b-a4b-it|local_Gemma-4_E4B_Q8_0_think,
est_Latn,https://en.wikivoyage.org/wiki/Travel_agencies,1,"Millise reisi puhul on selle lõigu kohaselt kõige vähem tõenäoline, et broneerimisel on vaja reisibüroo abi?",4,anthropic_claude-haiku-4.5|anthropic_claude-sonnet-4.6|google_gemma-4-26b-a4b-it|local_Gemma-4_E4B_Q8_0_think,
est_Latn,https://en.wikivoyage.org/wiki/Travel_agencies,2,Millise stsenaariumi kohaselt oleks reisijale reisibüroo abi kõige kasulikum selle lõigu järgi?,4,anthropic_claude-haiku-4.5|anthropic_claude-sonnet-4.6|google_gemma-4-26b-a4b-it|local_Gemma-4_E4B_Q8_0_think,
est_Latn,https://en.wikivoyage.org/wiki/Travel_basics,2,"Milline inimene võib selles lõigus oleva teabe põhjal kogeda pettumust, kui ta reisib võõrasse kohta?",4,anthropic_claude-haiku-4.5|anthropic_claude-sonnet-4.6|google_gemma-4-26b-a4b-it|local_Gemma-4_E4B_Q8_0_think,
est_Latn,https://en.wikivoyage.org/wiki/Travel_in_developing_countries,2,"Millist järgmistest asjadest ei ole mainitud kui midagi, millele arengumaal sisseelamise ajal kulutada?",4,anthropic_claude-haiku-4.5|anthropic_claude-sonnet-4.6|google_gemma-4-26b-a4b-it|local_Gemma-4_E4B_Q8_0_think,
est_Latn,https://en.wikivoyage.org/wiki/Travel_insurance,2,Milline järgmistest asjaoludest ei pea selle lõigu järgi olema märgitud kindlustuspoliisil?,4,anthropic_claude-haiku-4.5|anthropic_claude-sonnet-4.6|google_gemma-4-26b-a4b-it|local_Gemma-4_E4B_Q8_0_think,
est_Latn,https://en.wikivoyage.org/wiki/Travel_photography/Film,2,Milline järgmistest filmiformaatidest pakub DSLR-filmiga sarnast lahutusvõimet?,4,anthropic_claude-haiku-4.5|anthropic_claude-sonnet-4.6|google_gemma-4-26b-a4b-it|local_Gemma-4_E4B_Q8_0_think,
est_Latn,https://en.wikivoyage.org/wiki/Travel_writing,1,Milline neist oleks selle lõigu kohaselt viimane samm reisikirjutamise äriga alustamisel?,4,anthropic_claude-haiku-4.5|anthropic_claude-sonnet-4.6|google_gemma-4-26b-a4b-it|local_Gemma-4_E4B_Q8_0_think,
est_Latn,https://en.wikivoyage.org/wiki/Travellers%27_diarrhea,1,Millises kliimas esinevad tavaliselt soolestikuprobleemid?,4,anthropic_claude-haiku-4.5|anthropic_claude-sonnet-4.6|google_gemma-4-26b-a4b-it|local_Gemma-4_E4B_Q8_0_think,
est_Latn,https://en.wikivoyage.org/wiki/Vancouver,1,Milline Vancouveri reisisihtkoht oleks selle lõigu järgi hinnateadlikele reisijatele kõige vähem atraktiivne? ,4,anthropic_claude-haiku-4.5|anthropic_claude-sonnet-4.6|google_gemma-4-26b-a4b-it|local_Gemma-4_E4B_Q8_0_think,
est_Latn,https://en.wikivoyage.org/wiki/Victoria_Falls,1,"Millal peaksid reisijad selle lõigu kohaselt külastama juga, kui nad otsivad takistusteta vaateid?",4,anthropic_claude-haiku-4.5|anthropic_claude-sonnet-4.6|google_gemma-4-26b-a4b-it|local_Gemma-4_E4B_Q8_0_think,
est_Latn,https://en.wikivoyage.org/wiki/Victoria_Falls,2,Milline on selle lõigu kohaselt Victoria joa külastamise eelis ajavahemikus novembrist märtsini?,4,anthropic_claude-haiku-4.5|anthropic_claude-sonnet-4.6|google_gemma-4-26b-a4b-it|local_Gemma-4_E4B_Q8_0_think,
est_Latn,https://en.wikivoyage.org/wiki/Video_recording,1,Milline järgmistest asjadest ei ole selle lõigu kohaselt soovitatav drooni kasutamisel filmimiseks?,4,anthropic_claude-haiku-4.5|anthropic_claude-sonnet-4.6|google_gemma-4-26b-a4b-it|local_Gemma-4_E4B_Q8_0_think,
est_Latn,https://en.wikivoyage.org/wiki/Video_recording,2,Kus on selle lõigu järgi parimad kohad drooniga filmimiseks?,4,anthropic_claude-haiku-4.5|anthropic_claude-sonnet-4.6|google_gemma-4-26b-a4b-it|local_Gemma-4_E4B_Q8_0_think,
est_Latn,https://en.wikivoyage.org/wiki/Visa,1,Milline väide seoses viisamenetluse registreerimisnõuetega ei vasta sellele lõigule tuginedes tõele?,4,anthropic_claude-haiku-4.5|anthropic_claude-sonnet-4.6|google_gemma-4-26b-a4b-it|local_Gemma-4_E4B_Q8_0_think,
est_Latn,https://en.wikivoyage.org/wiki/Visa,2,"Milline järgmistest ei ole koht, kuhu turist võib minna oma registreerimisega tegelemiseks?",4,anthropic_claude-haiku-4.5|anthropic_claude-sonnet-4.6|google_gemma-4-26b-a4b-it|local_Gemma-4_E4B_Q8_0_think,
est_Latn,https://en.wikivoyage.org/wiki/Volunteer_travel,1,Kellele ei tuleks reisimise ajal vabatahtlikuna tegutsemine kasuks?,4,anthropic_claude-haiku-4.5|anthropic_claude-sonnet-4.6|google_gemma-4-26b-a4b-it|local_Gemma-4_E4B_Q8_0_think,
est_Latn,https://en.wikivoyage.org/wiki/Volunteer_travel,2,Kuidas on selle lõigu kohaselt vabatahtlik töö välismaal viibides väikese eelarvega reisijale kasulik?,4,anthropic_claude-haiku-4.5|anthropic_claude-sonnet-4.6|google_gemma-4-26b-a4b-it|local_Gemma-4_E4B_Q8_0_think,
est_Latn,https://en.wikivoyage.org/wiki/Walt_Disney_World,2,Milline järgmistest väidetest Walt Disney Worldi kohta ei vasta tõele?,4,anthropic_claude-haiku-4.5|anthropic_claude-sonnet-4.6|google_gemma-4-26b-a4b-it|local_Gemma-4_E4B_Q8_0_think,
est_Latn,https://en.wikivoyage.org/wiki/Water_safety,1,Mis võib selle lõigu järgi olla peaaegu võimatu isegi oskuslikele ujujatele?,4,anthropic_claude-haiku-4.5|anthropic_claude-sonnet-4.6|google_gemma-4-26b-a4b-it|local_Gemma-4_E4B_Q8_0_think,
est_Latn,https://en.wikivoyage.org/wiki/Water_safety,2,"Mida peaksite tegema, kui jääte voolu kätte?",4,anthropic_claude-haiku-4.5|anthropic_claude-sonnet-4.6|google_gemma-4-26b-a4b-it|local_Gemma-4_E4B_Q8_0_think,
est_Latn,https://en.wikivoyage.org/wiki/West_Africa,1,"Milline järgmistest soovituslikest nõuannetest ei oleks selle lõigu kohaselt soovitatav naistele, kes reisivad selles piirkonnas?",4,anthropic_claude-haiku-4.5|anthropic_claude-sonnet-4.6|google_gemma-4-26b-a4b-it|local_Gemma-4_E4B_Q8_0_think,
est_Latn,https://en.wikivoyage.org/wiki/West_Africa,2,Milline oleks selles lõigus kirjeldatud piirkonna põhjal kasulik nõuanne naisreisijatele?,4,anthropic_claude-haiku-4.5|anthropic_claude-sonnet-4.6|google_gemma-4-26b-a4b-it|local_Gemma-4_E4B_Q8_0_think,
est_Latn,https://en.wikivoyage.org/wiki/Wildlife_photography,1,Millise stsenaariumi põhjal võib selle lõigu järgi loodusfotograafil olla vaja kasutada eriobjektiivi?,4,anthropic_claude-haiku-4.5|anthropic_claude-sonnet-4.6|google_gemma-4-26b-a4b-it|local_Gemma-4_E4B_Q8_0_think,
fin_Latn,https://en.wikibooks.org/wiki/Blended_Learning_in_K-12/Synchronous_and_asynchronous_communication_methods,2,Mikä seuraavista epäsynkronisen viestinnän näkökulmista ei ole tekstikatkelman mukaan joustava opiskelijoiden kannalta?,0,,anthropic_claude-haiku-4.5|anthropic_claude-sonnet-4.6|google_gemma-4-26b-a4b-it|local_Gemma-4_E4B_Q8_0_think
fin_Latn,https://en.wikibooks.org/wiki/High_School_Earth_Science/Telescopes,2,Kuinka kauan ihmiset ovat suurentaneet esineitä linssien avulla?,0,,anthropic_claude-haiku-4.5|anthropic_claude-sonnet-4.6|google_gemma-4-26b-a4b-it|local_Gemma-4_E4B_Q8_0_think
fin_Latn,https://en.wikibooks.org/wiki/History_of_Rail_Transport/Early_Rail_Transportation,1,Mihin rautaa käytettiin ensin tekstikatkelman mukaan?,0,,anthropic_claude-haiku-4.5|anthropic_claude-sonnet-4.6|google_gemma-4-26b-a4b-it|local_Gemma-4_E4B_Q8_0_think
fin_Latn,https://en.wikibooks.org/wiki/The_Seven_Wonders_of_the_World/The_Great_Pyramid,1,Mitä Gizan ylätasangolla on?,0,,anthropic_claude-haiku-4.5|anthropic_claude-sonnet-4.6|google_gemma-4-26b-a4b-it|local_Gemma-4_E4B_Q8_0_think
fin_Latn,https://en.wikibooks.org/wiki/The_Seven_Wonders_of_the_World/The_Temple_of_Artemis,1,Kuka on tarinan mukaan vastuussa temppelin tuhonneesta tuhopoltosta?,0,,anthropic_claude-haiku-4.5|anthropic_claude-sonnet-4.6|google_gemma-4-26b-a4b-it|local_Gemma-4_E4B_Q8_0_think
fin_Latn,https://en.wikibooks.org/wiki/Wikijunior:Languages/Korean,1,Mikä seuraavista ei ole hangul-aakkostoa koskeva tosiseikka?,0,,anthropic_claude-haiku-4.5|anthropic_claude-sonnet-4.6|google_gemma-4-26b-a4b-it|local_Gemma-4_E4B_Q8_0_think
fin_Latn,"https://en.wikinews.org/wiki/Benin,_Nigeria_join_African_Union_continental_free_trade_bloc",1,"Minkä seuraavista Albert Muchanga ei sanonut olevan sellaista, josta olisi vielä sovittava?",0,,anthropic_claude-haiku-4.5|anthropic_claude-sonnet-4.6|google_gemma-4-26b-a4b-it|local_Gemma-4_E4B_Q8_0_think
fin_Latn,"https://en.wikinews.org/wiki/Beverly_Hall,_indicted_public_school_superintendent,_dies_aged_68",2,Mitä ei mainittu tekstikatkelmassa annettujen tietojen perusteella Atlanta Journal-Constitutionin artikkelissa?,0,,anthropic_claude-haiku-4.5|anthropic_claude-sonnet-4.6|google_gemma-4-26b-a4b-it|local_Gemma-4_E4B_Q8_0_think
fin_Latn,https://en.wikinews.org/wiki/Bomb_blasts_kill_several_in_Iran,1,Mitä tietoja tiedetään pommituksen jälkeisestä ajasta tekstikatkelman mukaan?,0,,anthropic_claude-haiku-4.5|anthropic_claude-sonnet-4.6|google_gemma-4-26b-a4b-it|local_Gemma-4_E4B_Q8_0_think
fin_Latn,https://en.wikinews.org/wiki/Hungary%27s_St_Stephen%27s_Day_hit_by_storm:_3_left_dead,2,Milloin voimakkaimmat tuulet alkoivat Versacen mukaan?,0,,anthropic_claude-haiku-4.5|anthropic_claude-sonnet-4.6|google_gemma-4-26b-a4b-it|local_Gemma-4_E4B_Q8_0_think
fin_Latn,https://en.wikinews.org/wiki/Jenson_Button_wins_2006_Hungarian_Grand_Prix,1,Milloin Alonso päätti kilpailunsa?,0,,anthropic_claude-haiku-4.5|anthropic_claude-sonnet-4.6|google_gemma-4-26b-a4b-it|local_Gemma-4_E4B_Q8_0_think
fin_Latn,https://en.wikinews.org/wiki/La_La_Land_receives_record-equalling_fourteen_Oscar_nominations;_Hacksaw_Ridge_gets_six,2,Minkä palkinnon saajaksi elokuva oli ehdolla?,0,,anthropic_claude-haiku-4.5|anthropic_claude-sonnet-4.6|google_gemma-4-26b-a4b-it|local_Gemma-4_E4B_Q8_0_think
fin_Latn,https://en.wikinews.org/wiki/New_South_Wales_government_starts_trial_of_hunting_in_national_parks,2,Mikä väite kuvaa tarkasti tuhoeläinten valvontakokeilua?,0,,anthropic_claude-haiku-4.5|anthropic_claude-sonnet-4.6|google_gemma-4-26b-a4b-it|local_Gemma-4_E4B_Q8_0_think
fin_Latn,https://en.wikinews.org/wiki/Researchers_report_rapid_formation_of_new_bird_species_in_Gal%C3%A1pagos_islands,1,Minkä seuraavan tapahtuminen kesti tekstikatkelman mukaan vähemmän aikaa kuin tutkijat olivat uskoneet?,0,,anthropic_claude-haiku-4.5|anthropic_claude-sonnet-4.6|google_gemma-4-26b-a4b-it|local_Gemma-4_E4B_Q8_0_think
fin_Latn,https://en.wikinews.org/wiki/Spanish_football:_Sevilla_signs_Aleix_Vidal_from_FC_Barcelona,1,Missä joukkueessa Vidal aloitti pelaamisen kolme kautta aiemmin tekstikatkelman mukaan?,0,,anthropic_claude-haiku-4.5|anthropic_claude-sonnet-4.6|google_gemma-4-26b-a4b-it|local_Gemma-4_E4B_Q8_0_think
fin_Latn,https://en.wikinews.org/wiki/US_officials_flood_Grand_Canyon_to_restore_ecosystem,2,Mihin padon valmistuminen vaikutti pysyvästi?,0,,anthropic_claude-haiku-4.5|anthropic_claude-sonnet-4.6|google_gemma-4-26b-a4b-it|local_Gemma-4_E4B_Q8_0_think
fin_Latn,https://en.wikivoyage.org/wiki/Auckland,2,Missä uiminen on todennäköisesti turvallisinta tekstikatkelman mukaan?,0,,anthropic_claude-haiku-4.5|anthropic_claude-sonnet-4.6|google_gemma-4-26b-a4b-it|local_Gemma-4_E4B_Q8_0_think
