language,link,question_number,question,n_correct,correct_models,wrong_models
fin_Latn,https://en.wikivoyage.org/wiki/Travel_advisories,2,"Mitä ulkomaan kansalainen ei todennäköisesti koe, jos maata koskee matkustustiedote?",4,anthropic_claude-haiku-4.5|anthropic_claude-sonnet-4.6|google_gemma-4-26b-a4b-it|local_Gemma-4_E4B_Q8_0_think,
fin_Latn,https://en.wikivoyage.org/wiki/Travel_basics,2,"Millainen henkilö saattaa kokea pettymyksiä, kun hän matkailee vieraassa paikassa tekstikatkelman tietojen perusteella?",4,anthropic_claude-haiku-4.5|anthropic_claude-sonnet-4.6|google_gemma-4-26b-a4b-it|local_Gemma-4_E4B_Q8_0_think,
fin_Latn,https://en.wikivoyage.org/wiki/Travel_in_developing_countries,2,"Mitä seuraavista ei mainita törsäämisen arvoisena, kun olet sopeutumassa kehitysmaahan?",4,anthropic_claude-haiku-4.5|anthropic_claude-sonnet-4.6|google_gemma-4-26b-a4b-it|local_Gemma-4_E4B_Q8_0_think,
fin_Latn,https://en.wikivoyage.org/wiki/Travel_writing,1,Mikä seuraavista olisi matkakirjoitusalan aloittamisessa viimeinen vaihe tekstikatkelman mukaan?,4,anthropic_claude-haiku-4.5|anthropic_claude-sonnet-4.6|google_gemma-4-26b-a4b-it|local_Gemma-4_E4B_Q8_0_think,
fin_Latn,https://en.wikivoyage.org/wiki/Travellers%27_diarrhea,1,Minkä tyyppisessä ilmastossa tavataan useimmin suolisto-ongelmia?,4,anthropic_claude-haiku-4.5|anthropic_claude-sonnet-4.6|google_gemma-4-26b-a4b-it|local_Gemma-4_E4B_Q8_0_think,
fin_Latn,https://en.wikivoyage.org/wiki/Travellers%27_diarrhea,2,Mille altistuminen säännöllisesti aiheuttaa immuniteetin tekstikatkelman mukaan?,4,anthropic_claude-haiku-4.5|anthropic_claude-sonnet-4.6|google_gemma-4-26b-a4b-it|local_Gemma-4_E4B_Q8_0_think,
fin_Latn,https://en.wikivoyage.org/wiki/Valley_of_the_Kings,1,Mitä Tutankhamonin haudasta ei enää löydy?,4,anthropic_claude-haiku-4.5|anthropic_claude-sonnet-4.6|google_gemma-4-26b-a4b-it|local_Gemma-4_E4B_Q8_0_think,
fin_Latn,https://en.wikivoyage.org/wiki/Vancouver,1,Mikä Vancouverin kohteista on vähiten houkuttelevin hintatietoisille matkailijoille tekstikatkelman mukaan? ,4,anthropic_claude-haiku-4.5|anthropic_claude-sonnet-4.6|google_gemma-4-26b-a4b-it|local_Gemma-4_E4B_Q8_0_think,
fin_Latn,https://en.wikivoyage.org/wiki/Vancouver,2,Mikä kohde tarjoaa matkailijoille todennäköisemmin autenttisen Vancouver-kokemuksen tekstikatkelman mukaan?,4,anthropic_claude-haiku-4.5|anthropic_claude-sonnet-4.6|google_gemma-4-26b-a4b-it|local_Gemma-4_E4B_Q8_0_think,
fin_Latn,https://en.wikivoyage.org/wiki/Victoria_Falls,1,"Milloin matkailijoiden tulisi vierailla putouksilla, jos he haluavat nähdä ne mahdollisimman hyvin?",4,anthropic_claude-haiku-4.5|anthropic_claude-sonnet-4.6|google_gemma-4-26b-a4b-it|local_Gemma-4_E4B_Q8_0_think,
fin_Latn,https://en.wikivoyage.org/wiki/Victoria_Falls,2,Miksi Victoria Fallsissa kannattaa vierailla marraskuusta maaliskuuhun välisenä aikana tekstikatkelman mukaan?,4,anthropic_claude-haiku-4.5|anthropic_claude-sonnet-4.6|google_gemma-4-26b-a4b-it|local_Gemma-4_E4B_Q8_0_think,
fin_Latn,https://en.wikivoyage.org/wiki/Video_recording,1,"Mitä seuraavista ei tekstikatkelman mukaan suositella silloin, kun kuvaat droonilla?",4,anthropic_claude-haiku-4.5|anthropic_claude-sonnet-4.6|google_gemma-4-26b-a4b-it|local_Gemma-4_E4B_Q8_0_think,
fin_Latn,https://en.wikivoyage.org/wiki/Video_recording,2,Mitkä ovat tekstikatkelman mukaan parhaita paikkoja kuvata droonilla?,4,anthropic_claude-haiku-4.5|anthropic_claude-sonnet-4.6|google_gemma-4-26b-a4b-it|local_Gemma-4_E4B_Q8_0_think,
fin_Latn,https://en.wikivoyage.org/wiki/Visa,1,Mikä seuraavista viisumiprosessin rekisteröitymisvaatimusta koskevista väittämistä ei ole totta tekstikatkelman mukaan?,4,anthropic_claude-haiku-4.5|anthropic_claude-sonnet-4.6|google_gemma-4-26b-a4b-it|local_Gemma-4_E4B_Q8_0_think,
fin_Latn,https://en.wikivoyage.org/wiki/Visa,2,Minne seuraavista paikoista turisti ei mene hoitamaan rekisteröintiä?,4,anthropic_claude-haiku-4.5|anthropic_claude-sonnet-4.6|google_gemma-4-26b-a4b-it|local_Gemma-4_E4B_Q8_0_think,
fin_Latn,https://en.wikivoyage.org/wiki/Volunteer_travel,1,Kuka ei hyötyisi vapaaehtoistyötä matkailun aikana?,4,anthropic_claude-haiku-4.5|anthropic_claude-sonnet-4.6|google_gemma-4-26b-a4b-it|local_Gemma-4_E4B_Q8_0_think,
fin_Latn,https://en.wikivoyage.org/wiki/Walt_Disney_World,1,Mitä voidaan pitää epätyypillisenä keskimääräisessä Walt Disney Word -vierailussa tekstikatkelman mukaan?,4,anthropic_claude-haiku-4.5|anthropic_claude-sonnet-4.6|google_gemma-4-26b-a4b-it|local_Gemma-4_E4B_Q8_0_think,
fin_Latn,https://en.wikivoyage.org/wiki/Walt_Disney_World,2,Mikä seuraavista Walt Disney Worldia koskevista väittämistä ei ole totta?,4,anthropic_claude-haiku-4.5|anthropic_claude-sonnet-4.6|google_gemma-4-26b-a4b-it|local_Gemma-4_E4B_Q8_0_think,
fin_Latn,https://en.wikivoyage.org/wiki/Water_safety,1,Mikä on tekstikatkelman mukaan lähes mahdollista jopa taitaville uimareille?,4,anthropic_claude-haiku-4.5|anthropic_claude-sonnet-4.6|google_gemma-4-26b-a4b-it|local_Gemma-4_E4B_Q8_0_think,
fin_Latn,https://en.wikivoyage.org/wiki/Water_safety,2,"Mitä sinun pitäisi tehdä, jos jäät virran vietäväksi?",4,anthropic_claude-haiku-4.5|anthropic_claude-sonnet-4.6|google_gemma-4-26b-a4b-it|local_Gemma-4_E4B_Q8_0_think,
fin_Latn,https://en.wikivoyage.org/wiki/West_Africa,2,Mikä olisi hyvä vinkki naismatkailijoille tekstikatkelmassa kuvatun alueen perusteella?,4,anthropic_claude-haiku-4.5|anthropic_claude-sonnet-4.6|google_gemma-4-26b-a4b-it|local_Gemma-4_E4B_Q8_0_think,
fin_Latn,https://en.wikivoyage.org/wiki/Wildlife_photography,1,Millaisessa tilanteessa villieläinten valokuvaaja käyttäisi erikoisobjektiivia tekstikatkelman mukaan?,4,anthropic_claude-haiku-4.5|anthropic_claude-sonnet-4.6|google_gemma-4-26b-a4b-it|local_Gemma-4_E4B_Q8_0_think,
fin_Latn,https://en.wikivoyage.org/wiki/Winter_driving,1,"Mikä seuraavista aiheuttaisi todennäköisesti vähiten ongelmia kuljettajalle, joka ajaa vuoristosolissa?",4,anthropic_claude-haiku-4.5|anthropic_claude-sonnet-4.6|google_gemma-4-26b-a4b-it|local_Gemma-4_E4B_Q8_0_think,
fin_Latn,https://en.wikivoyage.org/wiki/Yellowstone_National_Park,1,Mikä seuraavista toimista saattaa vähentää eläimen hyökkäämisen todennäköisyyttä?,4,anthropic_claude-haiku-4.5|anthropic_claude-sonnet-4.6|google_gemma-4-26b-a4b-it|local_Gemma-4_E4B_Q8_0_think,
fin_Latn,https://en.wikivoyage.org/wiki/Yellowstone_National_Park,2,Mitä seuraavista ei mainita tekstikatkelmassa villieläinten hyökkäämisen mahdollisena syynä?,4,anthropic_claude-haiku-4.5|anthropic_claude-sonnet-4.6|google_gemma-4-26b-a4b-it|local_Gemma-4_E4B_Q8_0_think,
swe_Latn,https://en.wikibooks.org/wiki/Castles_of_England/Tudor_Castles,2,Vilken av följande detaljer i Kirby Muxloe-slottet var ovanlig under den omnämnda perioden?,0,,anthropic_claude-haiku-4.5|anthropic_claude-sonnet-4.6|google_gemma-4-26b-a4b-it|local_Gemma-4_E4B_Q8_0_think
swe_Latn,https://en.wikibooks.org/wiki/High_School_Biology/Nature_of_Science,2,Vad är inte vägledande för vetenskaplig forskning enligt avsnittet?,0,,anthropic_claude-haiku-4.5|anthropic_claude-sonnet-4.6|google_gemma-4-26b-a4b-it|local_Gemma-4_E4B_Q8_0_think
swe_Latn,https://en.wikibooks.org/wiki/High_School_Earth_Science/Telescopes,2,Hur länge har människor förstorat föremål med förstoringslinser?,0,,anthropic_claude-haiku-4.5|anthropic_claude-sonnet-4.6|google_gemma-4-26b-a4b-it|local_Gemma-4_E4B_Q8_0_think
swe_Latn,https://en.wikibooks.org/wiki/History_of_Rail_Transport/Early_Rail_Transportation,1,Vad började man enligt avsnittet använda järn till?,0,,anthropic_claude-haiku-4.5|anthropic_claude-sonnet-4.6|google_gemma-4-26b-a4b-it|local_Gemma-4_E4B_Q8_0_think
swe_Latn,https://en.wikibooks.org/wiki/Modern_Photography/Composition,1,Vad av följande är inte ett användningsområde för regeln om tredjedelar?,0,,anthropic_claude-haiku-4.5|anthropic_claude-sonnet-4.6|google_gemma-4-26b-a4b-it|local_Gemma-4_E4B_Q8_0_think
swe_Latn,https://en.wikibooks.org/wiki/The_Seven_Wonders_of_the_World/The_Great_Pyramid,1,Vad kan vi hitta i Giza?,0,,anthropic_claude-haiku-4.5|anthropic_claude-sonnet-4.6|google_gemma-4-26b-a4b-it|local_Gemma-4_E4B_Q8_0_think
swe_Latn,https://en.wikibooks.org/wiki/Wikijunior:Asia/Bhutan,1,Vilket uttalande om Drukgyal Dzong stämmer inte?,0,,anthropic_claude-haiku-4.5|anthropic_claude-sonnet-4.6|google_gemma-4-26b-a4b-it|local_Gemma-4_E4B_Q8_0_think
swe_Latn,https://en.wikibooks.org/wiki/Wikijunior:Asia/Bhutan,2,Vilket uttalande beskriver konsekvenserna av branden vid Drukgyal Dzong?,0,,anthropic_claude-haiku-4.5|anthropic_claude-sonnet-4.6|google_gemma-4-26b-a4b-it|local_Gemma-4_E4B_Q8_0_think
swe_Latn,https://en.wikibooks.org/wiki/Wikijunior:How_Things_Work/Flush_Toilet,2,På vilken av följande platser fanns inte sofistikerade avloppssystem?,0,,anthropic_claude-haiku-4.5|anthropic_claude-sonnet-4.6|google_gemma-4-26b-a4b-it|local_Gemma-4_E4B_Q8_0_think
swe_Latn,https://en.wikibooks.org/wiki/Wikijunior:How_Things_Work/Ice_Skates,2,Vad av följande beskriver enligt avsnittet skenan på en modern skridsko?,0,,anthropic_claude-haiku-4.5|anthropic_claude-sonnet-4.6|google_gemma-4-26b-a4b-it|local_Gemma-4_E4B_Q8_0_think
swe_Latn,https://en.wikibooks.org/wiki/Wikijunior:How_Things_Work/Time,2,Hur kan man mäta tid utifrån en händelse enligt avsnittet?,0,,anthropic_claude-haiku-4.5|anthropic_claude-sonnet-4.6|google_gemma-4-26b-a4b-it|local_Gemma-4_E4B_Q8_0_think
swe_Latn,https://en.wikibooks.org/wiki/Wikijunior:Languages/Korean,1,Vad av följande är inte sant om alfabetet Hangul?,0,,anthropic_claude-haiku-4.5|anthropic_claude-sonnet-4.6|google_gemma-4-26b-a4b-it|local_Gemma-4_E4B_Q8_0_think
swe_Latn,https://en.wikibooks.org/wiki/Wikijunior:World_Heritage_Sites/Pyramids_of_Giza,1,"Vilken kvalitet hos Giza-pyramiderna var det nya kungarikets egyptier inte förundrade över, enligt avsnittet?",0,,anthropic_claude-haiku-4.5|anthropic_claude-sonnet-4.6|google_gemma-4-26b-a4b-it|local_Gemma-4_E4B_Q8_0_think
swe_Latn,https://en.wikibooks.org/wiki/Wikijunior:World_War_II/Submarines,2,I början hade ubåtar en begränsad räckvidd inom ett område. Vilket?,0,,anthropic_claude-haiku-4.5|anthropic_claude-sonnet-4.6|google_gemma-4-26b-a4b-it|local_Gemma-4_E4B_Q8_0_think
swe_Latn,https://en.wikinews.org/wiki/A_5.6_Richter_quake_hits_Western_Montana,1,Vart var jordbävningen centrerad i förhållande till Butte?,0,,anthropic_claude-haiku-4.5|anthropic_claude-sonnet-4.6|google_gemma-4-26b-a4b-it|local_Gemma-4_E4B_Q8_0_think
swe_Latn,"https://en.wikinews.org/wiki/Benin,_Nigeria_join_African_Union_continental_free_trade_bloc",1,Vad återstod inte att förhandla kring enligt Albert Muchanga?,0,,anthropic_claude-haiku-4.5|anthropic_claude-sonnet-4.6|google_gemma-4-26b-a4b-it|local_Gemma-4_E4B_Q8_0_think
swe_Latn,"https://en.wikinews.org/wiki/Beverly_Hall,_indicted_public_school_superintendent,_dies_aged_68",2,"Baserat på informationen i avsnittet, vad nämnde skribenten från Atlanta Journal-Constitution inte i sin rapport?",0,,anthropic_claude-haiku-4.5|anthropic_claude-sonnet-4.6|google_gemma-4-26b-a4b-it|local_Gemma-4_E4B_Q8_0_think
swe_Latn,https://en.wikinews.org/wiki/Burning_debris_from_satellites_spotted_over_several_US_cities,1,Vilken information om kollisionen är inte fastställd?,0,,anthropic_claude-haiku-4.5|anthropic_claude-sonnet-4.6|google_gemma-4-26b-a4b-it|local_Gemma-4_E4B_Q8_0_think
swe_Latn,https://en.wikinews.org/wiki/Businessman_and_founder_of_The_Weather_Channel_Frank_Batten_dies_at_82,2,Till vad av följande gjorde Batten inte en donation?,0,,anthropic_claude-haiku-4.5|anthropic_claude-sonnet-4.6|google_gemma-4-26b-a4b-it|local_Gemma-4_E4B_Q8_0_think
swe_Latn,https://en.wikinews.org/wiki/Canadian_Prime_Minister_Harper_agrees_to_send_%27Clean_Air_Act%27_to_committee,2,Vem kritiserade ”Clean Air Act” för att vara ett jippo i förspelet till valet?,0,,anthropic_claude-haiku-4.5|anthropic_claude-sonnet-4.6|google_gemma-4-26b-a4b-it|local_Gemma-4_E4B_Q8_0_think
swe_Latn,https://en.wikinews.org/wiki/China_promises_cut_in_carbon_dioxide_emissions,2,Vad nämnde Hu inte?,0,,anthropic_claude-haiku-4.5|anthropic_claude-sonnet-4.6|google_gemma-4-26b-a4b-it|local_Gemma-4_E4B_Q8_0_think
swe_Latn,https://en.wikinews.org/wiki/Hollywood_sign_modified_to_read_%27Hollyweed%27,2,Vad gjorde den misstänkte gärningsmannen med skylten?,0,,anthropic_claude-haiku-4.5|anthropic_claude-sonnet-4.6|google_gemma-4-26b-a4b-it|local_Gemma-4_E4B_Q8_0_think
swe_Latn,https://en.wikinews.org/wiki/Hungary%27s_St_Stephen%27s_Day_hit_by_storm:_3_left_dead,1,Vad hände enligt Armand Versace precis innan människorna började reagera på vädret?,0,,anthropic_claude-haiku-4.5|anthropic_claude-sonnet-4.6|google_gemma-4-26b-a4b-it|local_Gemma-4_E4B_Q8_0_think
swe_Latn,https://en.wikinews.org/wiki/Iranian_passenger_jet%27s_wheel_catches_fire,1,Vilka av följande flygolyckor hade flest dödsfall?,0,,anthropic_claude-haiku-4.5|anthropic_claude-sonnet-4.6|google_gemma-4-26b-a4b-it|local_Gemma-4_E4B_Q8_0_think
swe_Latn,https://en.wikinews.org/wiki/Iranian_passenger_jet%27s_wheel_catches_fire,2,Vad av följande är inte en anledning till att flygolyckor är vanliga i Iran?,0,,anthropic_claude-haiku-4.5|anthropic_claude-sonnet-4.6|google_gemma-4-26b-a4b-it|local_Gemma-4_E4B_Q8_0_think
swe_Latn,https://en.wikinews.org/wiki/Jenson_Button_wins_2006_Hungarian_Grand_Prix,1,När avslutade Alonso sitt lopp?,0,,anthropic_claude-haiku-4.5|anthropic_claude-sonnet-4.6|google_gemma-4-26b-a4b-it|local_Gemma-4_E4B_Q8_0_think
swe_Latn,https://en.wikinews.org/wiki/Nathalie_Carpanedo_finishes_wild_card_run_at_2013_IPC_Alpine_World_Championships,1,Hur många deltagare avslutade inte storslalomen?,0,,anthropic_claude-haiku-4.5|anthropic_claude-sonnet-4.6|google_gemma-4-26b-a4b-it|local_Gemma-4_E4B_Q8_0_think
swe_Latn,"https://en.wikinews.org/wiki/Strong_6.3_earthquake_reported_in_Sumatra,_Indonesia",2,Vad orsakade jordbävningen enligt texten?,0,,anthropic_claude-haiku-4.5|anthropic_claude-sonnet-4.6|google_gemma-4-26b-a4b-it|local_Gemma-4_E4B_Q8_0_think
swe_Latn,https://en.wikinews.org/wiki/Women%E2%80%99s_boxing_to_be_included_in_the_2012_Olympics_for_the_first_time,2,"Vad kommer Amir Khan att stödja trots sina åsikter, enligt texten?",0,,anthropic_claude-haiku-4.5|anthropic_claude-sonnet-4.6|google_gemma-4-26b-a4b-it|local_Gemma-4_E4B_Q8_0_think
swe_Latn,https://en.wikivoyage.org/wiki/Aggregators,1,"Med utgångspunkt från texten, vad av följande bör en prismedveten resenär göra sist?",0,,anthropic_claude-haiku-4.5|anthropic_claude-sonnet-4.6|google_gemma-4-26b-a4b-it|local_Gemma-4_E4B_Q8_0_think
swe_Latn,https://en.wikivoyage.org/wiki/Airline_alliances,1,"Med utgångspunkt från texten, vilket av följande ska du prioritera när du väljer ett Frequent flyer-flygbolag i en allians?",0,,anthropic_claude-haiku-4.5|anthropic_claude-sonnet-4.6|google_gemma-4-26b-a4b-it|local_Gemma-4_E4B_Q8_0_think
swe_Latn,https://en.wikivoyage.org/wiki/Auschwitz-Birkenau,1,Vad av följande skulle ses som opassande vid ett besök på platsen som beskrivs i texten?,0,,anthropic_claude-haiku-4.5|anthropic_claude-sonnet-4.6|google_gemma-4-26b-a4b-it|local_Gemma-4_E4B_Q8_0_think
swe_Latn,https://en.wikivoyage.org/wiki/Auxiliary_languages,2,Vilket påstående är inte en korrekt beskrivning av hjälpspråk?,0,,anthropic_claude-haiku-4.5|anthropic_claude-sonnet-4.6|google_gemma-4-26b-a4b-it|local_Gemma-4_E4B_Q8_0_think
swe_Latn,https://en.wikivoyage.org/wiki/Dangerous_animals,1,Vad av följande bör människor undvika att göra när det gäller älgar?,0,,anthropic_claude-haiku-4.5|anthropic_claude-sonnet-4.6|google_gemma-4-26b-a4b-it|local_Gemma-4_E4B_Q8_0_think
swe_Latn,https://en.wikivoyage.org/wiki/Sleep,2,Vad av följande nämns inte i texten som en fördel med att boka genom en resebyrå?,0,,anthropic_claude-haiku-4.5|anthropic_claude-sonnet-4.6|google_gemma-4-26b-a4b-it|local_Gemma-4_E4B_Q8_0_think
swe_Latn,https://en.wikivoyage.org/wiki/Thimphu,1,Vilket scenario skulle vara det bästa för en resenär som tänker ta en buss från den distriktsgemensamma stationen enligt texten?,0,,anthropic_claude-haiku-4.5|anthropic_claude-sonnet-4.6|google_gemma-4-26b-a4b-it|local_Gemma-4_E4B_Q8_0_think
swe_Latn,https://en.wikivoyage.org/wiki/Timbuktu,2,Vilket av följande faktum om Timbuktu är sant?,0,,anthropic_claude-haiku-4.5|anthropic_claude-sonnet-4.6|google_gemma-4-26b-a4b-it|local_Gemma-4_E4B_Q8_0_think
swe_Latn,https://en.wikivoyage.org/wiki/Working_abroad,2,"Om du arbetar utomlands men har din bas någon annanstans, var är det då sannolikt att du deklarerar enligt texten?",0,,anthropic_claude-haiku-4.5|anthropic_claude-sonnet-4.6|google_gemma-4-26b-a4b-it|local_Gemma-4_E4B_Q8_0_think
swe_Latn,https://en.wikibooks.org/wiki/Accordion/Right_hand,2,Vad av följande höjer volymen när man spelar dragspel?,1,google_gemma-4-26b-a4b-it,anthropic_claude-haiku-4.5|anthropic_claude-sonnet-4.6|local_Gemma-4_E4B_Q8_0_think
swe_Latn,https://en.wikibooks.org/wiki/Blended_Learning_in_K-12/Synchronous_and_asynchronous_communication_methods,2,Vilken av följande aspekter av asynkron kommunikation är enligt avsnittet inte flexibel för studenter?,1,local_Gemma-4_E4B_Q8_0_think,anthropic_claude-haiku-4.5|anthropic_claude-sonnet-4.6|google_gemma-4-26b-a4b-it
swe_Latn,https://en.wikibooks.org/wiki/Communication_Theory/Uses_and_Gratifications,2,Vad av följande återspeglar inte en motivation till att använda internet för personligt engagemang?,1,google_gemma-4-26b-a4b-it,anthropic_claude-haiku-4.5|anthropic_claude-sonnet-4.6|local_Gemma-4_E4B_Q8_0_think
swe_Latn,https://en.wikibooks.org/wiki/Modern_Photography/Lenses,2,När kan det vara bättre med ett zoomobjektiv än ett fast objektiv enligt avsnittet?,1,local_Gemma-4_E4B_Q8_0_think,anthropic_claude-haiku-4.5|anthropic_claude-sonnet-4.6|google_gemma-4-26b-a4b-it
swe_Latn,https://en.wikibooks.org/wiki/Wikijunior:Big_Cats/Tiger,1,Vad av följande är inte en av tigerns styrkor?,1,google_gemma-4-26b-a4b-it,anthropic_claude-haiku-4.5|anthropic_claude-sonnet-4.6|local_Gemma-4_E4B_Q8_0_think
swe_Latn,https://en.wikinews.org/wiki/Another_arrest_in_Minnesota_school_shooting,2,För hur många offer höll man i begravning samtidigt som nyheterna täckte en annan arrestering enligt avsnittet?,1,local_Gemma-4_E4B_Q8_0_think,anthropic_claude-haiku-4.5|anthropic_claude-sonnet-4.6|google_gemma-4-26b-a4b-it
swe_Latn,https://en.wikinews.org/wiki/Dark_matter_lacks_extra_gravitational_force,1,Forskarna som ingick i programmet hoppades observera effekter orsakade av vad?,1,anthropic_claude-haiku-4.5,anthropic_claude-sonnet-4.6|google_gemma-4-26b-a4b-it|local_Gemma-4_E4B_Q8_0_think
swe_Latn,https://en.wikinews.org/wiki/DeLay_declares_%27victory%27_in_war_on_U.S._budget_fat,1,Vad kritiserade de konservativa inte enligt avsnittet?,1,google_gemma-4-26b-a4b-it,anthropic_claude-haiku-4.5|anthropic_claude-sonnet-4.6|local_Gemma-4_E4B_Q8_0_think
swe_Latn,https://en.wikinews.org/wiki/EBay_to_acquire_Skype,2,Vad vill eBay uppnå med köpet?,1,local_Gemma-4_E4B_Q8_0_think,anthropic_claude-haiku-4.5|anthropic_claude-sonnet-4.6|google_gemma-4-26b-a4b-it
swe_Latn,https://en.wikinews.org/wiki/Nathalie_Carpanedo_finishes_wild_card_run_at_2013_IPC_Alpine_World_Championships,2,Vilket av följande påståenden är en korrekt beskrivning av tävlingsresultaten från mästerskapet?,1,google_gemma-4-26b-a4b-it,anthropic_claude-haiku-4.5|anthropic_claude-sonnet-4.6|local_Gemma-4_E4B_Q8_0_think
swe_Latn,https://en.wikinews.org/wiki/War_between_top_lawyers_in_Greece,2,Vilken grupp människor uppges inte ha varit delaktiga i skandalen inom det grekiska rättssamhället?,1,anthropic_claude-haiku-4.5,anthropic_claude-sonnet-4.6|google_gemma-4-26b-a4b-it|local_Gemma-4_E4B_Q8_0_think
swe_Latn,https://en.wikinews.org/wiki/Wikimedia_Foundation_addresses_controversial_content_conflict,2,Vad togs bort från webbplatsen enligt texten?,1,google_gemma-4-26b-a4b-it,anthropic_claude-haiku-4.5|anthropic_claude-sonnet-4.6|local_Gemma-4_E4B_Q8_0_think
swe_Latn,https://en.wikivoyage.org/wiki/Auckland,2,Var är det säkrast att simma enligt texten?,1,google_gemma-4-26b-a4b-it,anthropic_claude-haiku-4.5|anthropic_claude-sonnet-4.6|local_Gemma-4_E4B_Q8_0_think
swe_Latn,https://en.wikivoyage.org/wiki/Beijing_2022,2,Vad av följande kommer Beijing att stå värd för 2022 enligt texten?,1,anthropic_claude-haiku-4.5,anthropic_claude-sonnet-4.6|google_gemma-4-26b-a4b-it|local_Gemma-4_E4B_Q8_0_think
swe_Latn,https://en.wikivoyage.org/wiki/Cross_country_skiing,2,Vad kan vara till hjälp för skidåkare som vill komma upp i hastighet enligt texten?,1,local_Gemma-4_E4B_Q8_0_think,anthropic_claude-haiku-4.5|anthropic_claude-sonnet-4.6|google_gemma-4-26b-a4b-it
swe_Latn,https://en.wikivoyage.org/wiki/Flying_to_Africa,1,Vad behöver inte räknas med när man jämför ett totalt resepris till Afrika med ett jorden-runt biljettpris?,1,anthropic_claude-sonnet-4.6,anthropic_claude-haiku-4.5|google_gemma-4-26b-a4b-it|local_Gemma-4_E4B_Q8_0_think
swe_Latn,https://en.wikivoyage.org/wiki/Moldova,2,Vad av följande har republiken Transnistrien som skiljer sig från resten av Moldavien?  ,1,anthropic_claude-sonnet-4.6,anthropic_claude-haiku-4.5|google_gemma-4-26b-a4b-it|local_Gemma-4_E4B_Q8_0_think
swe_Latn,https://en.wikivoyage.org/wiki/Montevideo,1,När bör en resenär besöka Montevideo om de vill undvika blåst enligt texten?,1,local_Gemma-4_E4B_Q8_0_think,anthropic_claude-haiku-4.5|anthropic_claude-sonnet-4.6|google_gemma-4-26b-a4b-it
swe_Latn,https://en.wikivoyage.org/wiki/Travel_basics,1,Vad kan hjälpa en resenär att undvika besvikelse under en resa till en ny plats enligt texten?,1,local_Gemma-4_E4B_Q8_0_think,anthropic_claude-haiku-4.5|anthropic_claude-sonnet-4.6|google_gemma-4-26b-a4b-it
swe_Latn,https://en.wikivoyage.org/wiki/War_zone_safety,1,Vilken av följande frågor går man sannolikt inte igenom i en professionell utbildningskurs eller i litteratur enligt texten?,1,local_Gemma-4_E4B_Q8_0_think,anthropic_claude-haiku-4.5|anthropic_claude-sonnet-4.6|google_gemma-4-26b-a4b-it
swe_Latn,https://en.wikibooks.org/wiki/Animal_Behavior/Biological_Rhythms,1,Vad av följande kommer att fortsätta även i närvaro av extern påverkan?,2,anthropic_claude-haiku-4.5|google_gemma-4-26b-a4b-it,anthropic_claude-sonnet-4.6|local_Gemma-4_E4B_Q8_0_think
swe_Latn,https://en.wikibooks.org/wiki/Castles_of_England/The_Development_of_the_Castle,2,Vad av följande nämns inte i avsnittet som en doft eller ett ljud som kunde förekomma kring slotten?,2,google_gemma-4-26b-a4b-it|local_Gemma-4_E4B_Q8_0_think,anthropic_claude-haiku-4.5|anthropic_claude-sonnet-4.6
swe_Latn,https://en.wikibooks.org/wiki/European_History/Revolution_in_France,2,Vad av följande tvingade inte folkmassan kungen och drottningen att göra?,2,anthropic_claude-haiku-4.5|local_Gemma-4_E4B_Q8_0_think,anthropic_claude-sonnet-4.6|google_gemma-4-26b-a4b-it
swe_Latn,https://en.wikibooks.org/wiki/Introduction_to_Sociology/Socialization,1,Vad av följande brukar inte stämma in på ”vilda” barn som har blivit försummade under uppväxten enligt avsnittet?,2,anthropic_claude-sonnet-4.6|google_gemma-4-26b-a4b-it,anthropic_claude-haiku-4.5|local_Gemma-4_E4B_Q8_0_think
swe_Latn,https://en.wikibooks.org/wiki/Managing_Groups_and_Teams/Motivation,1,Vad av följande kretsar inte innehållsteorier kring?,2,google_gemma-4-26b-a4b-it|local_Gemma-4_E4B_Q8_0_think,anthropic_claude-haiku-4.5|anthropic_claude-sonnet-4.6
swe_Latn,https://en.wikibooks.org/wiki/Pakistani_History/Prehistory/Bronze_Age/Indus_Valley_Civilization,2,Vilket av följande var enligt avsnittet inte ett möjligt namn på bronsålderscivilisationen som diskuteras?,2,anthropic_claude-haiku-4.5|local_Gemma-4_E4B_Q8_0_think,anthropic_claude-sonnet-4.6|google_gemma-4-26b-a4b-it
swe_Latn,https://en.wikibooks.org/wiki/Wikijunior:Ancient_Civilizations/Hebrews,1,Var spenderade den hebreiska familjen mycket tid?,2,google_gemma-4-26b-a4b-it|local_Gemma-4_E4B_Q8_0_think,anthropic_claude-haiku-4.5|anthropic_claude-sonnet-4.6
swe_Latn,https://en.wikibooks.org/wiki/Wikijunior:Biology/Origin_of_Life,1,Vad i följande exempel hindrar enligt avsnittet evolutionen?,2,anthropic_claude-haiku-4.5|local_Gemma-4_E4B_Q8_0_think,anthropic_claude-sonnet-4.6|google_gemma-4-26b-a4b-it
swe_Latn,https://en.wikibooks.org/wiki/Wikijunior:Solar_System/Moon,1,Vilket av följande uttalanden beskriver enligt avsnittet månens yttre lager?,2,anthropic_claude-haiku-4.5|google_gemma-4-26b-a4b-it,anthropic_claude-sonnet-4.6|local_Gemma-4_E4B_Q8_0_think
swe_Latn,https://en.wikibooks.org/wiki/Wikijunior:The_Elements/Hydrogen,1,Vad gör stjärnor efter fusioner enligt avsnittet?,2,anthropic_claude-haiku-4.5|google_gemma-4-26b-a4b-it,anthropic_claude-sonnet-4.6|local_Gemma-4_E4B_Q8_0_think
swe_Latn,https://en.wikinews.org/wiki/Car_women%27s_rugby_7%27s_tournament,1,Vad var något som inte utmärkte Sydafrika under rugbyturneringen?,2,anthropic_claude-haiku-4.5|local_Gemma-4_E4B_Q8_0_think,anthropic_claude-sonnet-4.6|google_gemma-4-26b-a4b-it
swe_Latn,https://en.wikinews.org/wiki/France_issues_pollution_alert_as_ship_splits_off_Basque_coast,1,Vad befarade myndigheterna inledningsvis om Luno:n enligt avsnittet?,2,google_gemma-4-26b-a4b-it|local_Gemma-4_E4B_Q8_0_think,anthropic_claude-haiku-4.5|anthropic_claude-sonnet-4.6
swe_Latn,https://en.wikinews.org/wiki/Khyber_Pakhtunkhwa_Provincial_Assembly_votes_to_merge_with_Pakistani_Federally_Administered_Tribal_Areas,2,Vilket av följande påståenden om FATA:s ”politiska agenter” stämmer inte?,2,google_gemma-4-26b-a4b-it|local_Gemma-4_E4B_Q8_0_think,anthropic_claude-haiku-4.5|anthropic_claude-sonnet-4.6
